{"apiVersion":"release.opensphere.io/v1alpha1","kind":"OpenSphereReleaseLock","channel":"edge","releaseDigest":"sha256:1fed9b66cfab9a9ae95880eea62a13effc98a07f82734d01c97a2c22618b0b48","resolvedAt":"2026-09-03T09:49:56.189Z","source":"https://github.com/opensphere-platform/OpenSphere-console","sourceRevision":"0b68c0821aa0347c6a8091d3b2e7b030a1903f23","trust":{"type":"localhost-edge/v1","repository":"opensphere-platform/OpenSphere-console","publisher":"scripts/Publish-LocalEdge.ps1","buildAuthority":"localhost","releaseClass":"pre-ga","gaEligible":false},"auxiliaryArtifacts":{"cliArtifacts":{"repository":"opensphere-os-cli","image":"ghcr.io/opensphere-platform/opensphere-os-cli@sha256:27da9166d90519ac3cfbf3dbe7e3280339712d950c0b31116cc337b8fb4014cb","sourceRevision":"0b68c0821aa0347c6a8091d3b2e7b030a1903f23","registryCredentialsRequired":true},"osShellControl":{"repository":"opensphere-console-os-shell-control","image":"ghcr.io/opensphere-platform/opensphere-console-os-shell-control@sha256:e0e68ce47d9da9c88db955a7c8f4ca7b1f568a7c03ede3d16633c000149d799a","sourceRevision":"0b68c0821aa0347c6a8091d3b2e7b030a1903f23","registryCredentialsRequired":true},"osShellRuntime":{"repository":"opensphere-os-shell-runtime","image":"ghcr.io/opensphere-platform/opensphere-os-shell-runtime@sha256:91c9150c93e7bddae3aa0d27310c884afe804b857da683b3c187d2c2dd5eda9e","sourceRevision":"0b68c0821aa0347c6a8091d3b2e7b030a1903f23","registryCredentialsRequired":true}},"components":{"console":{"repository":"opensphere-console","image":"ghcr.io/opensphere-platform/opensphere-console@sha256:9183a5f94ee0d0b418d9b1285a786f1cf14c5d3dd5e99322c45095a53e8f292b","sourceRevision":"0b68c0821aa0347c6a8091d3b2e7b030a1903f23","registryCredentialsRequired":true},"consoleApi":{"repository":"opensphere-console-api","image":"ghcr.io/opensphere-platform/opensphere-console-api@sha256:fca8442219fcbb61d216111495eeb2bad328ebff416a2cd7a6c17e4c11914211","sourceRevision":"0b68c0821aa0347c6a8091d3b2e7b030a1903f23","registryCredentialsRequired":true},"extensionController":{"repository":"opensphere-extension-controller","image":"ghcr.io/opensphere-platform/opensphere-extension-controller@sha256:2850828db589c339f59846d387b5137a8d4cbef86578995f1bc2c7caf3986a54","sourceRevision":"0b68c0821aa0347c6a8091d3b2e7b030a1903f23","registryCredentialsRequired":true},"registry":{"repository":"opensphere-registry","image":"ghcr.io/opensphere-platform/opensphere-registry@sha256:6618cf458fd0c8f8a03af7c3a45e684f2e64992b8ddbedcd4dc5d8f3c4106432","sourceRevision":"0b68c0821aa0347c6a8091d3b2e7b030a1903f23","registryCredentialsRequired":true},"osaaGateway":{"repository":"opensphere-console-osaa-gateway","image":"ghcr.io/opensphere-platform/opensphere-console-osaa-gateway@sha256:30ba17c6eee6144bc56d0f9ce5ff76f3218b4b985b58b69f5be2f05763e083af","sourceRevision":"0b68c0821aa0347c6a8091d3b2e7b030a1903f23","registryCredentialsRequired":true},"osdst":{"repository":"opensphere-osdst","image":"ghcr.io/opensphere-platform/opensphere-osdst@sha256:3611581b42c2c38a4d5e519772e449a5cf1d1448f1fd2f6e088a54ac2c2d01f8","sourceRevision":"0b68c0821aa0347c6a8091d3b2e7b030a1903f23","registryCredentialsRequired":true},"osaaGovernedAdapter":{"repository":"opensphere-osaa-governed-adapter","image":"ghcr.io/opensphere-platform/opensphere-osaa-governed-adapter@sha256:114d6948f46cb25b7f1d3a2a31c1003c7848717599ceb9b72000578bedc691dc","sourceRevision":"0b68c0821aa0347c6a8091d3b2e7b030a1903f23","registryCredentialsRequired":true},"notificationDispatcher":{"repository":"opensphere-console-notification-dispatcher","image":"ghcr.io/opensphere-platform/opensphere-console-notification-dispatcher@sha256:78559ae65b77d2e90e152831e3c0c07883fae17e4f021432c5320307cb6f6f45","sourceRevision":"0b68c0821aa0347c6a8091d3b2e7b030a1903f23","registryCredentialsRequired":true},"gitea":{"repository":"opensphere-console-gitea","image":"ghcr.io/opensphere-platform/opensphere-console-gitea@sha256:37e426fce281aef9f804262451d8f27c47efc44018ccb45cc3ea8bdf440bebbf","sourceRevision":"0b68c0821aa0347c6a8091d3b2e7b030a1903f23","registryCredentialsRequired":true},"supabasePostgres":{"repository":"opensphere-console-supabase-postgres","image":"ghcr.io/opensphere-platform/opensphere-console-supabase-postgres@sha256:faffaa78bf7eeaf219f2fc7d224a4d0b88a38e76107ab78d1603ec9aed071661","sourceRevision":"0b68c0821aa0347c6a8091d3b2e7b030a1903f23","registryCredentialsRequired":true},"supabaseAuth":{"repository":"opensphere-console-supabase-auth","image":"ghcr.io/opensphere-platform/opensphere-console-supabase-auth@sha256:6f25811cac4495c7e14d72793ea77e79731f3658d069c2392e4c725c20495759","sourceRevision":"0b68c0821aa0347c6a8091d3b2e7b030a1903f23","registryCredentialsRequired":true},"supabaseRest":{"repository":"opensphere-console-supabase-rest","image":"ghcr.io/opensphere-platform/opensphere-console-supabase-rest@sha256:144ba388ce763d5324158d172a9aba5d80cad2a8227727deb47aa503cb76f564","sourceRevision":"0b68c0821aa0347c6a8091d3b2e7b030a1903f23","registryCredentialsRequired":true},"supabaseStorage":{"repository":"opensphere-console-supabase-storage","image":"ghcr.io/opensphere-platform/opensphere-console-supabase-storage@sha256:e724f1e1fe8d05dcd120462a4787672c0eb3fb929f86c5d4833f2ae825e3fb73","sourceRevision":"0b68c0821aa0347c6a8091d3b2e7b030a1903f23","registryCredentialsRequired":true},"giteaPostgres":{"repository":"opensphere-console-gitea-postgres","image":"ghcr.io/opensphere-platform/opensphere-console-gitea-postgres@sha256:38ba007ea2c20502a90d494047962c5aab7743e35a41b75bb08f5373f7867d1a","sourceRevision":"0b68c0821aa0347c6a8091d3b2e7b030a1903f23","registryCredentialsRequired":true},"recovery":{"repository":"opensphere-console-recovery","image":"ghcr.io/opensphere-platform/opensphere-console-recovery@sha256:1edd09fc6a33bea991784b96701924065480d2c05b95a9076c1466391cf570e1","sourceRevision":"0b68c0821aa0347c6a8091d3b2e7b030a1903f23","registryCredentialsRequired":true},"beszelHub":{"repository":"opensphere-console-beszel-hub","image":"ghcr.io/opensphere-platform/opensphere-console-beszel-hub@sha256:31828c3278302f19cff2b6302f51da63548455ef0822b166c9fee39e5d98ed8d","sourceRevision":"0b68c0821aa0347c6a8091d3b2e7b030a1903f23","registryCredentialsRequired":true},"beszelAgent":{"repository":"opensphere-console-beszel-agent","image":"ghcr.io/opensphere-platform/opensphere-console-beszel-agent@sha256:6ab15cbc492a9edf6a1021af0df76484e0d4820cf110dcb3d32b7afb41d60401","sourceRevision":"0b68c0821aa0347c6a8091d3b2e7b030a1903f23","registryCredentialsRequired":true},"beszelBootstrap":{"repository":"opensphere-console-beszel-bootstrap","image":"ghcr.io/opensphere-platform/opensphere-console-beszel-bootstrap@sha256:706e19d30c563440093fc8a17a74805c8f45e7285d8764c3fc85f8a293b9caff","sourceRevision":"0b68c0821aa0347c6a8091d3b2e7b030a1903f23","registryCredentialsRequired":true}}}
